{
  "version": "1.0.0",
  "kind": "vocabulary",
  "profession": "nursing",
  "publishedAt": "2026-04-20T00:00:00Z",
  "authoritySource": "Dr. Ahmed Hesham — OET Nursing Vocabulary Rulebook v1",
  "sections": [
    { "id": "V01", "title": "Clinical Accuracy", "order": 1 },
    { "id": "V02", "title": "Register & Professional Fit", "order": 2 },
    { "id": "V03", "title": "Concision & Definition Quality", "order": 3 },
    { "id": "V04", "title": "Context, Synonyms & Collocations", "order": 4 },
    { "id": "V05", "title": "Pronunciation & Audio", "order": 5 },
    { "id": "V06", "title": "Taxonomy & Categorisation", "order": 6 },
    { "id": "V07", "title": "Example Sentences", "order": 7 },
    { "id": "V08", "title": "Profession-Specific Bands", "order": 8 }
  ],
  "rules": [
    { "id": "V01.1", "section": "V01", "severity": "critical", "title": "Definitions clinically accurate", "body": "Definitions reflect current nursing-process and evidence-based practice. No outdated nursing theory language ('handicapped', 'patient complains').", "appliesTo": "all" },
    { "id": "V01.2", "section": "V01", "severity": "critical", "title": "No brand names", "body": "Primary terms use generic medication or device names. Brand names only as secondary synonyms.", "appliesTo": "all" },
    { "id": "V01.3", "section": "V01", "severity": "major", "title": "Abbreviations expanded", "body": "Every abbreviation term includes its expansion.", "appliesTo": "all" },

    { "id": "V02.1", "section": "V02", "severity": "critical", "title": "Nursing handover register", "body": "Entries must read as they would in a SBAR / ISBAR nursing handover or nursing care plan.", "appliesTo": "all" },
    { "id": "V02.2", "section": "V02", "severity": "critical", "title": "No trademarked names", "body": "Never trademarked devices as primary terms.", "appliesTo": "all" },
    { "id": "V02.3", "section": "V02", "severity": "major", "title": "Person-centred language", "body": "Use 'patient with diabetes' not 'diabetic patient'; 'patient living with dementia' not 'demented'.", "appliesTo": "all" },
    { "id": "V02.4", "section": "V02", "severity": "minor", "title": "Conditions lowercase except eponymous", "body": "Lowercase diseases, capital for eponymous.", "appliesTo": "all" },

    { "id": "V03.1", "section": "V03", "severity": "critical", "title": "Definition ≤ 25 words", "body": "Concise noun-phrase definitions.", "appliesTo": "all", "params": { "maxWords": 25 } },
    { "id": "V03.2", "section": "V03", "severity": "major", "title": "No circular definitions", "body": "A definition must not repeat the term.", "appliesTo": "all" },

    { "id": "V04.1", "section": "V04", "severity": "major", "title": "Example sentence in nursing context", "body": "Authentic nursing sentence (handover, care-plan, medication round, discharge). 8–30 words.", "appliesTo": "all", "params": { "minWords": 8, "maxWords": 30 } },
    { "id": "V04.2", "section": "V04", "severity": "major", "title": "Synonyms genuine", "body": "English nursing synonyms only. No translations.", "appliesTo": "all" },
    { "id": "V04.3", "section": "V04", "severity": "minor", "title": "Collocations realistic", "body": "2–5 real nursing phrases.", "appliesTo": "all", "params": { "minCount": 2, "maxCount": 5 } },

    { "id": "V05.1", "section": "V05", "severity": "major", "title": "IPA in British RP", "body": "British Received Pronunciation IPA.", "appliesTo": "all" },
    { "id": "V05.2", "section": "V05", "severity": "minor", "title": "Audio for polysyllabic terms", "body": "Audio recommended ≥3 syllables.", "appliesTo": "all" },

    { "id": "V06.1", "section": "V06", "severity": "major", "title": "Canonical categories", "body": "One of: medical, anatomy, symptoms, procedures, pharmacology, conditions, clinical_communication, diagnostics, nursing_care.", "appliesTo": "all", "params": { "allowed": ["medical", "anatomy", "symptoms", "procedures", "pharmacology", "conditions", "clinical_communication", "diagnostics", "nursing_care"] } },
    { "id": "V06.2", "section": "V06", "severity": "minor", "title": "Difficulty tiered", "body": "easy|medium|hard.", "appliesTo": "all", "params": { "allowed": ["easy", "medium", "hard"] } },

    { "id": "V07.1", "section": "V07", "severity": "major", "title": "Example sentence passes core grammar", "body": "No contractions; 'the patient' not a running label; Latin abbreviations translated.", "appliesTo": "all" },
    { "id": "V07.2", "section": "V07", "severity": "minor", "title": "No second-person", "body": "Third-person clinical narrative.", "appliesTo": "all" },

    { "id": "V08.1", "section": "V08", "severity": "major", "title": "Balanced nursing bands", "body": "Bank covers: nursing assessment, care planning, medication administration, wound care, patient education, handover language.", "appliesTo": "all" }
  ],
  "tables": {
    "allowedCategories": ["medical", "anatomy", "symptoms", "procedures", "pharmacology", "conditions", "clinical_communication", "diagnostics", "nursing_care"],
    "difficultyTiers": { "A2": "easy", "B1": "medium", "B2": "medium", "C1": "hard" }
  }
}
